{
  "contract_version": "renewal-handoff/v1",
  "record_type": "renewal_handoff_fh_to_nursing",
  "renewal_id": "REN-SYN-0004",
  "line_id": "line-syn-rn-004",
  "patient_id": "patient-syn-rn-004",
  "service_id": "svc-syn-reu-01",
  "service_label": "Reumatologia (sintetico)",
  "treatment_id": "treatment-syn-rn-004",
  "lifecycle_state": "REQUESTED_TO_SERVICE",
  "window_state": "outside_window",
  "evaluated_at": "2026-10-04T08:00:00Z",
  "warning_window_days": 60,
  "valid_until": "2027-06-01",
  "valid_until_kind": "estimated",
  "valid_until_source": "prescription_issue_date_confirmed_duration_configured",
  "issue_date": "2026-06-01",
  "validity_days": 365,
  "exported_at": "2026-10-04T08:05:00Z",
  "exported_by_role": "pharmacy",
  "demo_flag": true
}
